Symbol,Name,Last Sale,Net Change,% Change,Market Cap,Country,IPO Year,Volume,Sector,Industry
IMCR,Immunocore Holdings plc American Depositary Shares,$38.98,-0.72,-1.814%,1706781710.00,United Kingdom,2021,34547,Health Care,Biotechnology: Biological Products (No Diagnostic Substances)
IMGN,ImmunoGen Inc. Common Stock,$6.55,-0.04,-0.607%,1309621096.00,United States,1989,1232908,Health Care,Major Pharmaceuticals
IMKTA,Ingles Markets Incorporated Class A Common Stock,$61.44,-1.05,-1.68%,1167014461.00,United States,1987,109246,Consumer Services,Food Chains
IMMP,Immutep Limited American Depositary Shares,$4.60,-0.29,-5.93%,298413629.00,Australia,,470835,Health Care,Major Pharmaceuticals
IMMR,Immersion Corporation Common Stock,$9.06,-0.08,-0.875%,279823001.00,United States,1999,359291,Technology,Computer peripheral equipment
IMNM,Immunome Inc. Common Stock,$17.15,-0.02,-0.116%,201636923.00,United States,2020,61473,Consumer Durables,Specialty Chemicals
IMOS,ChipMOS TECHNOLOGIES INC. American Depositary Shares,$34.65,-0.18,-0.517%,1259943508.00,Taiwan,,20538,Technology,Semiconductors
IMPL,Impel NeuroPharma Inc. Common Stock,$10.23,-0.09,-0.872%,227886252.00,United States,2021,41228,Health Care,Major Pharmaceuticals
IMRA,IMARA Inc. Common Stock,$8.25,-0.43,-4.954%,145534059.00,United States,2020,70957,Health Care,Biotechnology: Biological Products (No Diagnostic Substances)
IMTE,Integrated Media Technology Limited Ordinary Shares,$4.55,-0.28,-5.797%,38404425.00,Australia,,101931,Consumer Non-Durables,Consumer Electronics/Appliances
IMTX,Immatics N.V. Ordinary Shares,$11.79,-0.40,-3.281%,741692594.00,Germany,,99379,Health Care,Biotechnology: Biological Products (No Diagnostic Substances)
IMTXW,Immatics N.V. Warrants,$3.26,-0.33,-9.192%,0.00,Germany,,301,Health Care,Biotechnology: Biological Products (No Diagnostic Substances)
IMUX,Immunic Inc. Common Stock,$13.10,-1.10,-7.746%,284917651.00,United States,2014,144278,Health Care,Major Pharmaceuticals
IMV,IMV Inc. Common Shares,$2.34,-0.03,-1.266%,158642483.00,Canada,,62871,,
IMVT,Immunovant Inc. Common Stock,$10.76,0.02,0.186%,880294183.00,United States,2019,716785,Health Care,Major Pharmaceuticals
IMXI,International Money Express Inc. Common Stock,$14.82,-0.20,-1.332%,580100564.00,United States,2017,112782,Technology,EDP Services
INBK,First Internet Bancorp Common Stock,$32.85,-0.04,-0.122%,323703966.00,United States,,34651,Finance,Major Banks
INBKL,First Internet Bancorp 6.0% Fixed-to-Floating Rate Subordinated Notes due 2026,$25.99,0.00,0.00%,0.00,United States,,1,,
INBKZ,First Internet Bancorp 6.0% Fixed-to-Floating Rate Subordinated Notes Due 2029,$26.37,-0.02,-0.076%,0.00,United States,,2252,Finance,Major Banks
INBX,Inhibrx Inc. Common Stock,$25.95,1.51,6.178%,981188988.00,United States,2020,369123,Health Care,Major Pharmaceuticals
INCY,Incyte Corp. Common Stock,$82.76,0.12,0.145%,18200866957.00,United States,,1512600,Health Care,Biotechnology: Commercial Physical & Biological Resarch
INDB,Independent Bank Corp. Common Stock,$79.94,1.06,1.344%,2640494463.00,United States,,161061,Finance,Major Banks
INDI,indie Semiconductor Inc. Class A Common Stock,$9.47,-0.50,-5.015%,0.00,United States,,2984918,,
INDIW,indie Semiconductor Inc. Warrant,$2.04,-0.17,-7.692%,0.00,United States,,497453,,
INDT,INDUS Realty Trust Inc. (MD) Common Stock,$67.69,0.44,0.654%,522364948.00,United States,,12628,Finance,Real Estate
INFI,Infinity Pharmaceuticals Inc. Common Stock,$3.24,-0.14,-4.142%,287217061.00,United States,,1661946,Health Care,Major Pharmaceuticals
INFN,Infinera Corporation Common Stock,$10.23,-0.22,-2.105%,2097115116.00,United States,2007,1216506,Public Utilities,Telecommunications Equipment
INGN,Inogen Inc Common Stock,$65.64,2.14,3.37%,1470031430.00,United States,2014,81963,Health Care,Industrial Specialties
INKA,KludeIn I Acquisition Corp. Class A Common Stock,$9.79,0.01,0.102%,211096875.00,United States,2021,788,,
INKAU,KludeIn I Acquisition Corp. Unit,$10.15,0.03,0.296%,0.00,United States,2021,3374,,
INKAW,KludeIn I Acquisition Corp. Warrant,$0.76,0.00,0.00%,0.00,United States,2021,1,Finance,Business Services
INM,InMed Pharmaceuticals Inc. Common Shares,$2.85,0.00,0.00%,22944515.00,Canada,,79581,,
INMB,INmune Bio Inc. Common stock,$18.01,-0.63,-3.38%,268936810.00,United States,2019,190857,Health Care,Major Pharmaceuticals
INMD,InMode Ltd. Ordinary Shares,$89.57,-2.24,-2.44%,3420754524.00,Israel,2019,639294,Health Care,Medical/Nursing Services
INNV,InnovAge Holding Corp. Common Stock,$21.97,-0.29,-1.303%,2977297791.00,United States,2021,788995,Health Care,Hospital/Nursing Management
INO,Inovio Pharmaceuticals Inc. Common Stock,$8.63,-0.28,-3.143%,1807115614.00,United States,,3976247,Health Care,Biotechnology: Biological Products (No Diagnostic Substances)
INOD,Innodata Inc. Common Stock,$7.34,-0.10,-1.344%,193165407.00,United States,1993,75479,Technology,EDP Services
INOV,Inovalon Holdings Inc. Class A Common Stock,$32.80,-0.04,-0.122%,5113298403.00,United States,2015,369940,Technology,EDP Services
INPX,Inpixon Common Stock,$1.17,-0.07,-5.645%,130783331.00,United States,2014,2415379,Technology,Computer Software: Prepackaged Software
INSE,Inspired Entertainment Inc. Common Stock,$11.36,-0.44,-3.729%,263760149.00,United States,2014,330763,,
INSG,Inseego Corp. Common Stock,$9.92,-0.45,-4.339%,1020029347.00,United States,,1636312,Capital Goods,Telecommunications Equipment
INSM,Insmed Inc. Common Stock,$29.31,-0.66,-2.202%,3370415725.00,United States,,706869,Health Care,Major Pharmaceuticals
INTC,Intel Corporation Common Stock,$57.99,-0.20,-0.344%,234163620000.00,United States,,20792783,Technology,Semiconductors
INTG,Intergroup Corporation (The) Common Stock,$37.76,3.85,11.354%,84458321.00,United States,,2003,Consumer Services,Hotels/Resorts
INTU,Intuit Inc. Common Stock,$470.71,-6.26,-1.312%,128625869099.00,United States,1993,1359586,Technology,Computer Software: Prepackaged Software
INTZ,Intrusion Inc. Common Stock,$15.82,-1.18,-6.941%,278748495.00,United States,,153768,Miscellaneous,Diversified Manufacture
INVA,Innoviva Inc. Common Stock,$12.71,-0.07,-0.548%,882108978.00,United States,,507140,Health Care,Major Pharmaceuticals
INVE,Identiv Inc. Common Stock,$17.33,-0.13,-0.745%,380972218.00,United States,,425678,Technology,Computer peripheral equipment
INVO,INVO BioScience Inc. Common Stock,$4.54,-0.59,-11.501%,47438619.00,United States,,94893,Health Care,Medical/Dental Instruments
INVZ,Innoviz Technologies Ltd. Ordinary shares,$10.07,0.12,1.206%,1307297097.00,Israel,,698307,Capital Goods,Auto Parts:O.E.M.
INVZW,Innoviz Technologies Ltd. Warrant,$2.46,-0.10,-3.906%,0.00,Israel,,20276,Capital Goods,Auto Parts:O.E.M.
INZY,Inozyme Pharma Inc. Common Stock,$17.13,0.28,1.662%,402265383.00,United States,2020,97905,Health Care,Major Pharmaceuticals
IONS,Ionis Pharmaceuticals Inc. Common Stock,$36.68,-1.11,-2.937%,5170523867.00,United States,,1597648,Health Care,Major Pharmaceuticals
IOSP,Innospec Inc. Common Stock,$97.03,-1.17,-1.191%,2387738012.00,United States,,75880,Basic Industries,Industrial Specialties
IOVA,Iovance Biotherapeutics Inc. Common Stock,$23.68,-0.19,-0.796%,3619470998.00,United States,,2391392,Health Care,Major Pharmaceuticals
IPA,ImmunoPrecise Antibodies Ltd. Common Stock,$7.49,0.03,0.402%,142901710.00,Canada,,39369,,
IPAR,Inter Parfums Inc. Common Stock,$75.04,-0.77,-1.016%,2375168932.00,United States,,66631,Consumer Non-Durables,Package Goods/Cosmetics
IPDN,Professional Diversity Network Inc. Common Stock,$1.83,-0.27,-12.857%,24640990.00,United States,2013,505649,Technology,EDP Services
IPGP,IPG Photonics Corporation Common Stock,$207.07,0.22,0.106%,11094522773.00,United States,2006,198875,Technology,Semiconductors
IPHA,Innate Pharma S.A. ADS,$4.01,-0.09,-2.195%,316705650.00,France,2019,12280,Health Care,Major Pharmaceuticals
IPLDP,Interstate Power & Light Company Perp Prd Ser D,$26.1906,-0.1294,-0.492%,0.00,United States,,2840,Public Utilities,Power Generation
IPVIU,InterPrivate IV InfraTech Partners Inc. Units,$9.95,-0.03,-0.301%,0.00,United States,2021,282,,
IPVIW,InterPrivate IV InfraTech Partners Inc. Warrant,$1.10,0.00,0.00%,0.00,United States,2021,1,Finance,Business Services
IPW,iPower Inc. Common Stock,$7.44,-0.66,-8.148%,189485610.00,United States,2021,92275,Consumer Services,Catalog/Specialty Distribution
IPWR,Ideal Power Inc. Common Stock,$11.70,-1.30,-10.00%,68702938.00,United States,2013,105644,Capital Goods,Industrial Machinery/Components
IQ,iQIYI Inc. American Depositary Shares,$14.84,-0.72,-4.627%,11712988035.00,China,2018,8185868,Technology,Internet and Information Services
IRBT,iRobot Corporation Common Stock,$96.25,-1.29,-1.323%,2704143173.00,United States,2005,337095,,
IRCP,IRSA Propiedades Comerciales S.A. American Depositary Shares,$10.90,-0.57,-4.969%,343388281.00,Argentina,,30828,Consumer Services,Building operators
IRDM,Iridium Communications Inc Common Stock,$39.50,-0.30,-0.754%,5272414062.00,United States,,738087,Consumer Services,Telecommunications Equipment
IRIX,IRIDEX Corporation Common Stock,$7.63,-0.04,-0.522%,119224854.00,United States,1996,38568,Health Care,Biotechnology: Electromedical & Electrotherapeutic Apparatus
IRMD,iRadimed Corporation Common Stock,$29.79,0.39,1.327%,366788809.00,United States,2014,12330,Health Care,Medical/Dental Instruments
IROQ,IF Bancorp Inc. Common Stock,$22.56,0.00,0.00%,73102883.00,United States,2011,35,Finance,Finance: Consumer Services
IRTC,iRhythm Technologies Inc. Common Stock,$63.19,-0.31,-0.488%,1851659730.00,United States,2016,498281,Health Care,Medical/Dental Instruments
IRWD,Ironwood Pharmaceuticals Inc. Class A Common Stock,$11.18,-0.06,-0.534%,1810788120.00,United States,2010,1242048,Health Care,Major Pharmaceuticals
ISAA,Iron Spark I Inc. Class A Common Stock,$9.96,-0.01,-0.10%,197606400.00,United States,2021,904291,,
ISBC,Investors Bancorp Inc. Common Stock,$14.87,0.34,2.34%,3682854476.00,United States,,2060298,Finance,Savings Institutions
ISEE,IVERIC bio Inc. Common Stock,$5.90,-0.30,-4.839%,532505184.00,United States,2013,1061392,Health Care,Major Pharmaceuticals
ISIG,Insignia Systems Inc. Common Stock,$7.73,-0.12,-1.529%,13558652.00,United States,1991,14118,Technology,Advertising
ISLE,Isleworth Healthcare Acquisition Corporation Common stock,$9.75,0.00,0.00%,255364688.00,United States,2021,86169,,
ISLEW,Isleworth Healthcare Acquisition Corporation Warrant,$0.67,0.00,0.00%,0.00,United States,2021,4002,Consumer Services,Hotels/Resorts
ISNS,Image Sensing Systems Inc. Common Stock,$6.98,-0.10,-1.412%,37373272.00,United States,1995,97628,Capital Goods,Industrial Machinery/Components
ISRG,Intuitive Surgical Inc. Common Stock,$872.36,-0.43,-0.049%,103298666976.00,United States,2000,436365,Health Care,Medical/Dental Instruments
ISSC,Innovative Solutions and Support Inc. Common Stock,$5.9914,-0.0686,-1.132%,103302952.00,United States,2000,9096,Capital Goods,Military/Government/Technical
ISTR,Investar Holding Corporation Common Stock,$22.67,0.06,0.265%,236070214.00,United States,2014,59683,Finance,Commercial Banks
ISUN,iSun Inc. Common Stock,$9.77,-0.48,-4.683%,88787484.00,United States,2016,86885,Technology,Semiconductors
ITAC,Industrial Tech Acquisitions Inc. Class A common stock,$10.12,0.05,0.497%,97969048.00,United States,2020,38145,,
ITACU,Industrial Tech Acquisitions Inc. Unit,$11.3399,0.1902,1.706%,0.00,United States,2020,4617,,
ITACW,Industrial Tech Acquisitions Inc. Warrant,$1.04,-0.05,-4.587%,0.00,United States,2020,29069,,
ITCI,Intra-Cellular Therapies Inc. Common Stock,$43.31,0.56,1.31%,3516868408.00,United States,,504380,Health Care,Major Pharmaceuticals
ITHX,ITHAX Acquisition Corp. Class A Ordinary Shares,$9.69,0.00,0.00%,299057625.00,United States,2021,4382,Finance,Business Services
ITHXU,ITHAX Acquisition Corp. Unit,$9.98,0.05,0.504%,0.00,United States,2021,13700,Finance,Business Services
ITHXW,ITHAX Acquisition Corp. Warrant,$0.6499,-0.0201,-3.00%,0.00,United States,2021,401,Finance,Business Services
ITI,Iteris Inc. Common Stock,$6.97,0.01,0.144%,291679431.00,United States,,241996,Capital Goods,Telecommunications Equipment
ITIC,Investors Title Company Common Stock,$173.95,0.05,0.029%,329482522.00,United States,,3055,Finance,Specialty Insurers
ITMR,Itamar Medical Ltd. American Depository Shares,$20.76,-0.14,-0.67%,340196549.00,Israel,,8484,Health Care,Medical/Dental Instruments
ITOS,iTeos Therapeutics Inc. Common Stock,$26.40,-1.10,-4.00%,926745574.00,United States,2020,1603038,Consumer Durables,Specialty Chemicals
ITQ,Itiquira Acquisition Corp. Class A Ordinary Shares,$9.70,0.03,0.31%,278875000.00,United States,2021,12294,Finance,Business Services
ITQRU,Itiquira Acquisition Corp. Unit,$9.99,-0.01,-0.10%,0.00,United States,2021,1171,Finance,Business Services
ITQRW,Itiquira Acquisition Corp. Warrant,$0.7001,0.00,0.00%,0.00,United States,2021,12,Finance,Business Services
ITRI,Itron Inc. Common Stock,$98.92,-0.61,-0.613%,4464517979.00,United States,1993,258911,Capital Goods,Electrical Products
ITRM,Iterum Therapeutics plc Ordinary Share,$1.91,-0.15,-7.282%,342155049.00,Ireland,2018,17163136,Health Care,Major Pharmaceuticals
ITRN,Ituran Location and Control Ltd. Ordinary Shares,$26.29,-0.11,-0.417%,547181815.00,Israel,2005,107063,Technology,Electronic Components
IVA,Inventiva S.A. American Depository Shares,$15.20,-0.34,-2.188%,587179967.00,France,2020,37552,Consumer Services,Other Consumer Services
IVAC,Intevac Inc. Common Stock,$6.85,0.05,0.735%,165237173.00,United States,1995,213545,,
IZEA,IZEA Worldwide Inc. Common Stock,$2.60,-0.22,-7.801%,160489157.00,United States,,1537997,Technology,Advertising
JACK,Jack In The Box Inc. Common Stock,$118.16,-0.30,-0.253%,2626477731.00,United States,,306103,Consumer Services,Restaurants
JAGX,Jaguar Health Inc. Common Stock,$1.70,-0.09,-5.028%,233444479.00,United States,2015,13910038,Health Care,Major Pharmaceuticals
JAKK,JAKKS Pacific Inc. Common Stock,$12.87,-0.59,-4.383%,82314113.00,United States,1996,139804,Consumer Non-Durables,Recreational Products/Toys
JAMF,Jamf Holding Corp. Common Stock,$31.75,-0.21,-0.657%,3737772941.00,United States,2020,1051694,Technology,Computer Software: Prepackaged Software
JAN,JanOne Inc. Common Stock (NV),$8.07,-0.28,-3.353%,22784919.00,United States,,453152,Public Utilities,Environmental Services
JANX,Janux Therapeutics Inc. Common Stock,$18.58,-1.58,-7.837%,741370056.00,United States,2021,337285,,
JAZZ,Jazz Pharmaceuticals plc Common Stock (Ireland),$183.41,-3.01,-1.615%,11131895527.00,Ireland,2007,975037,Health Care,Major Pharmaceuticals
JBHT,J.B. Hunt Transport Services Inc. Common Stock,$166.78,2.17,1.318%,17623810381.00,United States,,759787,Transportation,Trucking Freight/Courier Services
JBLU,JetBlue Airways Corporation Common Stock,$18.07,-0.26,-1.418%,5721628530.00,United States,2002,6409446,Transportation,Air Freight/Delivery Services
JBSS,John B. Sanfilippo & Son Inc. Common Stock,$92.29,0.20,0.217%,1058412914.00,United States,1991,31322,Consumer Non-Durables,Specialty Foods
JCIC,Jack Creek Investment Corp. Class A Ordinary Shares,$9.72,-0.02,-0.205%,419175000.00,United States,2021,4607,Finance,Business Services
JCICU,Jack Creek Investment Corp. Units,$10.09,-0.01,-0.099%,0.00,United States,2021,27834,Finance,Business Services
JCICW,Jack Creek Investment Corp. Warrants,$0.75,-0.01,-1.316%,0.00,United States,2021,7844,Finance,Business Services
JCOM,j2 Global Inc. Common Stock,$130.27,1.25,0.969%,5876766033.00,United States,1999,1551567,Technology,Telecommunications Equipment
JCS,Communications Systems Inc. Common Stock,$7.14,0.02,0.281%,66548192.00,United States,,8402,Public Utilities,Telecommunications Equipment
JCTCF,Jewett-Cameron Trading Company Common Shares,$9.70,0.08,0.832%,33844862.00,United States,,337,,
JD,JD.com Inc. American Depositary Shares,$70.84,-0.59,-0.826%,110438515748.00,China,2014,8450103,Miscellaneous,Business Services
JFIN,Jiayin Group Inc. American Depositary Shares,$5.95,-0.16,-2.619%,321448750.00,China,2019,157856,Finance,Finance: Consumer Services
JFU,9F Inc. American Depositary Shares,$2.63,0.17,6.911%,535233091.00,China,2019,2329945,Finance,Finance: Consumer Services
JG,Aurora Mobile Limited American Depositary Shares,$3.02,-0.06,-1.948%,356098396.00,China,2018,643301,Technology,EDP Services
JJSF,J & J Snack Foods Corp. Common Stock,$177.97,1.41,0.799%,3387831225.00,United States,1986,175223,Consumer Non-Durables,Specialty Foods
JKHY,Jack Henry & Associates Inc. Common Stock,$163.91,0.58,0.355%,12159757598.00,United States,1985,428402,Technology,Retail: Computer Software & Peripheral Equipment
JMPNL,JMP Group LLC 7.25% Senior Notes due 2027,$25.4893,0.0893,0.352%,0.00,United States,,6263,Finance,Investment Bankers/Brokers/Service
JMPNZ,JMP Group LLC 6.875% Senior Notes due 2029,$25.04,0.00,0.00%,0.00,United States,,4029,Finance,Investment Bankers/Brokers/Service
JNCE,Jounce Therapeutics Inc. Common Stock,$7.55,0.56,8.011%,386623095.00,United States,2017,4460195,Health Care,Major Pharmaceuticals
JOAN,JOANN Inc. Common Stock,$15.48,-0.27,-1.714%,652635237.00,United States,2021,328104,Consumer Non-Durables,Department/Specialty Retail Stores
JOBS,51job Inc. American Depositary Shares,$74.11,0.05,0.068%,4997454739.00,China,2004,285712,Technology,Diversified Commercial Services
JOFF,JOFF Fintech Acquisition Corp. Class A Common Stock,$9.71,0.03,0.31%,401994000.00,United States,2021,16830,,
JOFFU,JOFF Fintech Acquisition Corp. Unit,$10.00,0.00,0.00%,0.00,United States,2021,15600,,
JOFFW,JOFF Fintech Acquisition Corp. Warrant,$0.90,-0.0199,-2.163%,0.00,United States,2021,7522,Finance,Business Services
JOUT,Johnson Outdoors Inc. Class A Common Stock,$122.42,0.80,0.658%,1238668575.00,United States,,23641,Consumer Non-Durables,Recreational Products/Toys
JRJC,China Finance Online Co. Limited American Depositary Shares,$9.81,-0.55,-5.309%,23955628.00,China,2004,59850,Finance,Investment Bankers/Brokers/Service
JRSH,Jerash Holdings (US) Inc. Common Stock,$6.4397,0.1097,1.733%,72929603.00,United States,2018,405,Basic Industries,Industrial Specialties
JRVR,James River Group Holdings Ltd. Common Shares,$36.64,0.79,2.204%,1365661835.00,Bermuda,2014,275104,Finance,Property-Casualty Insurers
JSM,Navient Corporation 6% Senior Notes due December 15 2043,$25.07,-0.01,-0.04%,0.00,United States,,12601,Finance,Finance: Consumer Services
JUPW,Jupiter Wellness Inc. Common Stock,$4.27,-0.17,-3.829%,48721503.00,United States,2020,100448,Health Care,Major Pharmaceuticals
JUPWW,Jupiter Wellness Inc. Warrant,$1.26,-0.0301,-2.333%,0.00,United States,2020,5534,Health Care,Major Pharmaceuticals
JVA,Coffee Holding Co. Inc. Common Stock,$5.52,-0.52,-8.609%,31511466.00,United States,2005,91421,Consumer Non-Durables,Specialty Foods
JWEL,Jowell Global Ltd. Ordinary Shares,$6.4404,0.1217,1.926%,163720468.00,China,2021,50324,Consumer Services,Other Consumer Services
JYAC,Jiya Acquisition Corp. Class A Common Stock,$9.90,0.07,0.712%,133126201.00,United States,2020,1970,,
JYNT,The Joint Corp. Common Stock,$77.97,1.62,2.122%,1109255799.00,United States,2014,300824,,
JZXN,Jiuzi Holdings Inc. Ordinary Shares,$7.88,-0.39,-4.716%,159176000.00,China,2021,449833,Consumer Durables,Automotive Aftermarket
KAII,Kismet Acquisition Two Corp. Class A Ordinary Shares,$9.74,0.00,0.00%,284895000.00,United States,2021,27893,Finance,Business Services
KAIIU,Kismet Acquisition Two Corp. Unit,$9.98,0.02,0.201%,0.00,United States,2021,18152,Finance,Business Services
KAIIW,Kismet Acquisition Two Corp. Warrant,$0.7501,-0.1296,-14.732%,0.00,United States,2021,3079,Finance,Business Services
KAIR,Kairos Acquisition Corp. Class A Ordinary Shares,$9.69,-0.07,-0.717%,334305000.00,United States,2021,107543,Finance,Business Services
KAIRU,Kairos Acquisition Corp. Unit,$9.97,-0.07,-0.697%,0.00,United States,2021,49714,Finance,Business Services
KAIRW,Kairos Acquisition Corp. Warrant,$0.70,-0.09,-11.392%,0.00,United States,2021,21391,Finance,Business Services
KALA,Kala Pharmaceuticals Inc. Common Stock,$5.70,-0.46,-7.468%,319541231.00,United States,2017,4029741,Health Care,Major Pharmaceuticals
KALU,Kaiser Aluminum Corporation Common Stock,$131.92,3.45,2.685%,2090659981.00,United States,,109235,Basic Industries,Aluminum
KALV,KalVista Pharmaceuticals Inc. Common Stock,$28.52,0.18,0.635%,696537372.00,United Kingdom,2015,134063,Health Care,Major Pharmaceuticals
KARO,Karooooo Ltd. Ordinary Shares,$37.85,-0.14,-0.369%,815303913.00,Singapore,2021,17056,Technology,Computer Software: Prepackaged Software
KBAL,Kimball International Inc. Class B Common Stock,$13.78,-0.14,-1.006%,506894020.00,United States,,147572,Consumer Durables,Industrial Specialties
KBNT,Kubient Inc. Common Stock,$5.14,-0.18,-3.383%,71869901.00,United States,2020,127852,Technology,EDP Services
KBNTW,Kubient Inc. Warrant,$1.96,-0.04,-2.00%,0.00,United States,2020,883,Technology,EDP Services
KBSF,KBS Fashion Group Limited Common Stock,$4.19,-0.24,-5.418%,10857543.00,China,2013,160683,Consumer Non-Durables,Apparel
KC,Kingsoft Cloud Holdings Limited American Depositary Shares,$34.47,-0.46,-1.317%,7697988173.00,China,2020,1623250,Technology,Computer Software: Prepackaged Software
KDMN,Kadmon Holdings Inc. Common Stock,$4.00,-0.13,-3.148%,687895456.00,United States,,1533532,Health Care,Major Pharmaceuticals
KDNY,Chinook Therapeutics Inc. Common Stock,$16.43,-0.39,-2.319%,733045743.00,United States,2015,221675,Health Care,Major Pharmaceuticals
KDP,Keurig Dr Pepper Inc. Common Stock,$34.68,-0.17,-0.488%,49156223224.00,United States,,7822882,Consumer Non-Durables,Beverages (Production/Distribution)
KE,Kimball Electronics Inc. Common Stock,$21.98,-0.11,-0.498%,548556201.00,United States,,39237,Capital Goods,Industrial Machinery/Components
KELYA,Kelly Services Inc. Class A Common Stock,$25.32,0.35,1.402%,996824245.00,United States,,84703,Technology,Diversified Commercial Services
KELYB,Kelly Services Inc. Class B Common Stock,$24.80,-0.4432,-1.756%,976352341.00,United States,,297,Technology,Diversified Commercial Services
KEQU,Kewaunee Scientific Corporation Common Stock,$12.50,0.85,7.296%,34534963.00,United States,,12893,Capital Goods,Medical Specialities
KERN,Akerna Corp. Common Stock,$4.27,-0.53,-11.042%,60030679.00,United States,2018,1508507,Health Care,Managed Health Care
KERNW,Akerna Corp Warrant,$1.14,0.05,4.587%,0.00,United States,2018,18405,Health Care,Managed Health Care
KFFB,Kentucky First Federal Bancorp Common Stock,$7.0565,-0.0535,-0.752%,58051814.00,United States,,2366,Finance,Savings Institutions
KFRC,Kforce Inc. Common Stock,$62.85,0.01,0.016%,1377353728.00,United States,1995,117604,Technology,Diversified Commercial Services
KHC,The Kraft Heinz Company Common Stock,$42.76,-0.06,-0.14%,52301780258.00,United States,,5990940,Consumer Non-Durables,Farming/Seeds/Milling
KIDS,OrthoPediatrics Corp. Common Stock,$63.21,-0.47,-0.738%,1242646465.00,United States,2017,67381,Health Care,Medical/Dental Instruments
KIII,Kismet Acquisition Three Corp. Class A Ordinary Shares,$9.69,0.00,0.00%,353079375.00,United States,2021,20300,Finance,Business Services
KIIIU,Kismet Acquisition Three Corp. Unit,$9.96,-0.02,-0.20%,0.00,United States,2021,106,Finance,Business Services
KIIIW,Kismet Acquisition Three Corp. Warrant,$0.8024,0.00,0.00%,0.00,United States,2021,22,Finance,Business Services
KIN,Kindred Biosciences Inc. Common Stock,$6.34,0.28,4.62%,287034015.00,United States,2013,469953,Health Care,Major Pharmaceuticals
KINS,Kingstone Companies Inc. Common Stock,$8.31,-0.02,-0.24%,88756226.00,United States,,6984,Finance,Specialty Insurers
KINZ,KINS Technology Group Inc. Class A Common Stock,$9.88,-0.02,-0.202%,340860000.00,United States,2021,5706,,
KINZU,KINS Technology Group Inc. Unit,$10.2457,-0.0143,-0.139%,0.00,United States,2020,2110,,
KINZW,KINS Technology Group Inc. Warrant,$0.79,0.045,6.04%,0.00,United States,2021,1550,Finance,Business Services
KIRK,Kirkland's Inc. COMMONSTOCK,$23.43,0.18,0.774%,333937926.00,United States,2002,397089,Miscellaneous,Diversified Commercial Services
KLAC,KLA Corporation Common Stock,$320.59,-4.62,-1.421%,49140606812.00,United States,1980,718447,Capital Goods,Electronic Components
KLAQ,KL Acquisition Corp Class A Common Stock,$9.73,0.00,0.00%,349671875.00,United States,2021,3854,,
KLAQU,KL Acquisition Corp Unit,$9.98,0.02,0.201%,0.00,United States,2021,878,,
KLAQW,KL Acquisition Corp Warrant,$0.76,0.00,0.00%,0.00,United States,2021,107,Finance,Business Services
KLDO,Kaleido Biosciences Inc. Common Stock,$6.57,-0.27,-3.947%,279347550.00,United States,2019,161432,Health Care,Biotechnology: Biological Products (No Diagnostic Substances)
KLIC,Kulicke and Soffa Industries Inc. Common Stock,$56.57,-0.08,-0.141%,3510368418.00,Singapore,,596561,Technology,Semiconductors
KLXE,KLX Energy Services Holdings Inc. Common Stock,$9.64,0.31,3.323%,85130907.00,United States,,240065,Energy,Oilfield Services/Equipment
KMDA,Kamada Ltd. Ordinary Shares,$5.81,-0.09,-1.525%,259970565.00,Israel,2013,33713,Health Care,Major Pharmaceuticals
KMPH,KemPharm Inc. Common Stock,$15.00,0.60,4.167%,427609455.00,United States,,815582,Health Care,Major Pharmaceuticals
KNBE,KnowBe4 Inc. Class A Common Stock,$22.44,0.65,2.983%,3807447197.00,United States,2021,228417,Technology,Computer Software: Prepackaged Software
KNDI,Kandi Technologies Group Inc Common Stock,$6.11,-0.21,-3.323%,460617961.00,China,,1024399,Capital Goods,Auto Parts:O.E.M.
KNSA,Kiniksa Pharmaceuticals Ltd. Class A Common Stock,$14.61,-0.63,-4.134%,998331017.00,United States,2018,476755,Health Care,Major Pharmaceuticals
KNSL,Kinsale Capital Group Inc. Common Stock,$167.39,4.42,2.712%,3818536836.00,United States,2016,110191,Finance,Property-Casualty Insurers
KNTE,Kinnate Biopharma Inc. Common Stock,$23.58,-0.92,-3.755%,1025835733.00,United States,2020,98773,Health Care,Major Pharmaceuticals
KOD,Kodiak Sciences Inc Common Stock,$82.32,-2.55,-3.005%,4220134059.00,United States,2018,231221,Health Care,Major Pharmaceuticals
