Symbol,Name,Last Sale,Net Change,% Change,Market Cap,Country,IPO Year,Volume,Sector,Industry
CSSEN,Chicken Soup for the Soul Entertainment Inc. 9.50% Notes due 2025,$26.21,0.0027,0.01%,0.00,United States,,1629,Consumer Services,Movies/Entertainment
CSSEP,Chicken Soup for the Soul Entertainment Inc. 9.75% Series A Cumulative Redeemable Perpetual Preferred Stock,$27.73,-0.01,-0.036%,0.00,United States,,1930,Consumer Services,Broadcasting
CSTE,Caesarstone Ltd. Ordinary Shares,$15.29,-0.21,-1.355%,526607798.00,Israel,2012,102469,Capital Goods,Multi-Sector Companies
CSTL,Castle Biosciences Inc. Common Stock,$72.59,0.73,1.016%,1818844874.00,United States,2019,218567,Health Care,Medical Specialities
CSTR,CapStar Financial Holdings Inc. Common Stock,$21.77,0.64,3.029%,481000269.00,United States,2016,79833,Finance,Major Banks
CSWC,Capital Southwest Corporation Common Stock,$26.15,-0.50,-1.876%,549767768.00,United States,,199078,Finance,Finance Companies
CSWI,CSW Industrials Inc. Common Stock,$116.50,1.85,1.614%,1827592469.00,United States,,49158,Basic Industries,Home Furnishings
CSX,CSX Corporation Common Stock,$98.41,1.12,1.151%,74535755257.00,United States,,4237833,Transportation,Railroads
CTAQ,Carney Technology Acquisition Corp. II Class A Common Stock,$9.76,0.01,0.103%,499834000.00,United States,2021,138735,,
CTAQU,Carney Technology Acquisition Corp. II Units,$10.045,0.035,0.35%,0.00,United States,2020,1209501,,
CTAQW,Carney Technology Acquisition Corp. II Warrant,$0.926,-0.002,-0.216%,0.00,United States,2021,6951,Finance,Business Services
CTAS,Cintas Corporation Common Stock,$357.80,4.54,1.285%,37588033887.00,United States,1983,343355,Miscellaneous,Business Services
CTBI,Community Trust Bancorp Inc. Common Stock,$42.65,0.32,0.756%,760512579.00,United States,,34400,Finance,Major Banks
CTG,Computer Task Group Inc. Common Stock,$9.70,0.15,1.571%,149167269.00,United States,,25656,Technology,EDP Services
CTHR,Charles & Colvard Ltd Common Stock,$2.70,-0.01,-0.369%,80602965.00,United States,1997,119218,Consumer Services,Consumer Specialties
CTIB,Yunhong CTI Ltd. Common Stock,$1.90,-0.04,-2.062%,8539755.00,United States,1997,61298,Miscellaneous,Diversified Commercial Services
CTIC,CTI BioPharma Corp. (DE) Common Stock,$2.45,-0.05,-2.00%,228541419.00,United States,1997,396383,Health Care,Major Pharmaceuticals
CTLP,Cantaloupe Inc. Common Stock,$12.41,-0.07,-0.561%,882491394.00,United States,,308023,Technology,EDP Services
CTMX,CytomX Therapeutics Inc. Common Stock,$7.08,-0.16,-2.21%,460278800.00,United States,2015,462357,Health Care,Major Pharmaceuticals
CTRE,CareTrust REIT Inc. Common Stock,$23.62,-0.35,-1.46%,2286063968.00,United States,,338655,Consumer Services,Real Estate Investment Trusts
CTRM,Castor Maritime Inc. Common Shares,$3.18,-0.16,-4.79%,28605960.00,Cyprus,,6322264,Transportation,Marine Transportation
CTRN,Citi Trends Inc. Common Stock,$81.26,-4.97,-5.764%,751971995.00,United States,2005,258654,,
CTSH,Cognizant Technology Solutions Corporation Class A Common Stock,$70.35,-0.44,-0.622%,37103426039.00,United States,1998,2975393,Technology,EDP Services
CTSO,Cytosorbents Corporation Common Stock,$8.24,-0.01,-0.121%,355620923.00,United States,,161812,Health Care,Medical/Dental Instruments
CTXR,Citius Pharmaceuticals Inc. Common Stock,$3.23,0.48,17.455%,437580849.00,United States,,36963736,Health Care,Major Pharmaceuticals
CTXRW,Citius Pharmaceuticals Inc. Warrant,$1.595,-0.1563,-8.925%,0.00,United States,,28169,Health Care,Major Pharmaceuticals
CTXS,Citrix Systems Inc. Common Stock,$119.88,-0.78,-0.646%,14885145355.00,United States,1995,1256825,Technology,Computer Software: Prepackaged Software
CUBA,Herzfeld Caribbean Basin Fund Inc. (The) Common Stock,$6.48,0.04,0.621%,39746149.00,United States,,22886,Finance,Investment Managers
CUE,Cue Biopharma Inc. Common Stock,$13.19,-0.41,-3.015%,402314376.00,United States,2018,164688,Health Care,Major Pharmaceuticals
CUEN,Cuentas Inc. Common Stock,$2.35,-0.10,-4.082%,32499562.00,United States,,88783,Technology,Computer Software: Prepackaged Software
CUENW,Cuentas Inc. Warrant,$0.60,-0.10,-14.286%,0.00,United States,,1530,Miscellaneous,Business Services
CURI,CuriosityStream Inc. Class A Common Stock,$14.37,-0.61,-4.072%,755376854.00,United States,2020,597068,Consumer Services,Broadcasting
CURIW,CuriosityStream Inc. Warrant,$4.90,-0.39,-7.372%,0.00,United States,2020,11266,Consumer Services,Movies/Entertainment
CUTR,Cutera Inc. Common Stock,$45.48,-0.06,-0.132%,809692902.00,United States,2004,83223,Health Care,Biotechnology: Electromedical & Electrotherapeutic Apparatus
CVAC,CureVac N.V. Ordinary Shares,$98.20,-0.80,-0.808%,18286785931.00,Germany,2020,452458,Health Care,Major Pharmaceuticals
CVBF,CVB Financial Corporation Common Stock,$22.19,0.37,1.696%,3016041989.00,United States,,325928,Finance,Major Banks
CVCO,Cavco Industries Inc. Common Stock When Issued,$216.70,1.58,0.734%,1988663701.00,United States,,41042,Basic Industries,Homebuilding
CVCY,Central Valley Community Bancorp Common Stock,$20.34,0.10,0.494%,254852247.00,United States,,68342,Finance,Major Banks
CVET,Covetrus Inc. Common Stock,$27.60,-0.03,-0.109%,3769867550.00,United States,,354359,Health Care,Managed Health Care
CVGI,Commercial Vehicle Group Inc. Common Stock,$11.18,-0.06,-0.534%,368223630.00,United States,2004,154548,Capital Goods,Auto Parts:O.E.M.
CVGW,Calavo Growers Inc. Common Stock,$65.73,-1.18,-1.764%,1162364719.00,United States,,221566,Consumer Non-Durables,Specialty Foods
CVLG,Covenant Logistics Group Inc. Class A Common Stock,$23.06,0.31,1.363%,386301397.00,United States,,57726,Transportation,Trucking Freight/Courier Services
CVLT,Commvault Systems Inc. Common Stock,$79.25,-2.10,-2.581%,3647579758.00,United States,2006,369582,Technology,Computer Software: Prepackaged Software
CVLY,Codorus Valley Bancorp Inc Common Stock,$19.73,0.30,1.544%,194867133.00,United States,,30328,Finance,Savings Institutions
CVV,CVD Equipment Corporation Common Stock,$4.29,0.03,0.704%,28675565.00,United States,,31860,Technology,Industrial Machinery/Components
CWBC,Community West Bancshares Common Stock,$13.005,0.055,0.425%,110886001.00,United States,,1531,Finance,Major Banks
CWBR,CohBar Inc. Common Stock,$1.30,-0.08,-5.797%,80324823.00,United States,,364514,Health Care,Biotechnology: In Vitro & In Vivo Diagnostic Substances
CWCO,Consolidated Water Co. Ltd. Ordinary Shares,$12.83,-0.26,-1.986%,195034924.00,Cayman Islands,,136571,Public Utilities,Water Supply
CWST,Casella Waste Systems Inc. Class A Common Stock,$66.08,0.44,0.67%,3394088979.00,United States,1997,103255,Public Utilities,Environmental Services
CXDC,China XD Plastics Company Limited Common Stock,$0.638,-0.002,-0.313%,45010161.00,China,,120263,Consumer Non-Durables,Plastic Products
CXDO,Crexendo Inc. Common Stock,$5.47,0.19,3.598%,117836901.00,United States,,17640,Consumer Services,Telecommunications Equipment
CYAD,Celyad Oncology SA American Depositary Shares,$5.48,0.01,0.183%,82228255.00,Belgium,2015,64643,Health Care,Major Pharmaceuticals
CYAN,Cyanotech Corporation Common Stock,$2.80,-0.21,-6.977%,17071804.00,United States,,94899,Consumer Non-Durables,Farming/Seeds/Milling
CYBE,CyberOptics Corporation Common Stock,$35.00,0.21,0.604%,255478160.00,United States,1987,59156,Capital Goods,Electronic Components
CYBR,CyberArk Software Ltd. Ordinary Shares,$138.01,-1.69,-1.21%,5487230953.00,Israel,2014,327268,Technology,Computer Software: Prepackaged Software
CYCC,Cyclacel Pharmaceuticals Inc. Common Stock,$6.69,-0.36,-5.106%,61776196.00,United States,,122225,Health Care,Major Pharmaceuticals
CYCN,Cyclerion Therapeutics Inc. Common Stock,$3.77,-0.52,-12.121%,152386827.00,United States,,1916500,Health Care,Major Pharmaceuticals
CYRN,CYREN Ltd. Ordinary Shares,$0.703,-0.0412,-5.536%,53175063.00,United States,,674475,Technology,Computer Software: Prepackaged Software
CYRX,CryoPort Inc. Common Stock,$60.45,-1.04,-1.691%,2761444015.00,United States,,293985,,
CYTH,Cyclo Therapeutics Inc. Common Stock,$10.25,-0.56,-5.18%,65176275.00,United States,,175958,Health Care,Major Pharmaceuticals
CYTHW,Cyclo Therapeutics Inc. Warrant,$5.60,0.34,6.464%,0.00,United States,,695,Basic Industries,Major Chemicals
CYTK,Cytokinetics Incorporated Common Stock,$22.28,0.43,1.968%,1598325826.00,United States,2004,1478440,Health Care,Major Pharmaceuticals
CZNC,Citizens & Northern Corp Common Stock,$24.92,0.02,0.08%,398777690.00,United States,,32021,Finance,Major Banks
CZR,Caesars Entertainment Inc. Common Stock,$106.50,-0.12,-0.113%,22226403350.00,United States,,2217670,Consumer Services,Hotels/Resorts
CZWI,Citizens Community Bancorp Inc. Common Stock,$13.52,-0.03,-0.221%,147213237.00,United States,,6179,Finance,Savings Institutions
DADA,Dada Nexus Limited American Depositary Shares,$29.89,-2.10,-6.565%,7077758851.00,China,2020,1609786,Consumer Services,Department/Specialty Retail Stores
DAIO,Data I/O Corporation Common Stock,$6.86,0.03,0.439%,57808280.00,United States,1981,32867,Capital Goods,Industrial Machinery/Components
DAKT,Daktronics Inc. Common Stock,$6.96,0.10,1.458%,314219000.00,United States,1994,91064,Capital Goods,Office Equipment/Supplies/Services
DARE,Dare Bioscience Inc. Common Stock,$1.34,-0.07,-4.965%,66129103.00,United States,2014,581692,Health Care,Major Pharmaceuticals
DAWN,Day One Biopharmaceuticals Inc. Common Stock,$20.02,-0.48,-2.341%,1239817359.00,United States,2021,7492,Health Care,Major Pharmaceuticals
DBDR,Roman DBDR Tech Acquisition Corp. Class A Common Stock,$10.12,0.00,0.00%,292923400.00,United States,2020,22512,,
DBDRU,Roman DBDR Tech Acquisition Corp. Unit,$10.85,0.14,1.307%,0.00,United States,2020,5422,,
DBDRW,Roman DBDR Tech Acquisition Corp. Warrant,$1.51,0.05,3.425%,0.00,United States,2020,287116,Finance,Business Services
DBGI,Digital Brands Group Inc. Common Stock,$3.26,-0.25,-7.123%,34206329.00,United States,2021,6759289,Consumer Non-Durables,Apparel
DBGIW,Digital Brands Group Inc. Warrant,$0.5505,-0.2194,-28.497%,0.00,United States,2021,12991,Consumer Non-Durables,Apparel
DBTX,Decibel Therapeutics Inc. Common Stock,$8.37,-0.26,-3.013%,208429162.00,United States,2021,85413,Health Care,Major Pharmaceuticals
DBVT,DBV Technologies S.A. American Depositary Shares,$6.32,-0.09,-1.404%,693909292.00,France,2014,43208,Health Care,Biotechnology: Biological Products (No Diagnostic Substances)
DBX,Dropbox Inc. Class A Common Stock,$29.23,-0.29,-0.982%,11425348331.00,United States,2018,3830216,Technology,Computer Software: Prepackaged Software
DCBO,Docebo Inc. Common Shares,$53.85,-3.35,-5.857%,1760588540.00,Canada,,64190,,
DCOM,Dime Community Bancshares Inc. Common Stock,$35.08,0.94,2.753%,1458761002.00,United States,,194581,Finance,Savings Institutions
DCOMP,Dime Community Bancshares Inc. Fixed-Rate Non-Cumulative Perpetual Preferred Stock Series A,$25.80,0.00,0.00%,0.00,United States,,12070,Finance,Savings Institutions
DCPH,Deciphera Pharmaceuticals Inc. Common Stock,$35.88,-0.18,-0.499%,2079766116.00,United States,2017,319452,Health Care,Major Pharmaceuticals
DCRB,Decarbonization Plus Acquisition Corporation Class A Common Stock,$10.50,-0.21,-1.961%,296264084.00,United States,2020,289463,,
DCRBU,Decarbonization Plus Acquisition Corporation Unit,$11.5513,-0.3817,-3.199%,0.00,United States,2020,6108,,
DCRBW,Decarbonization Plus Acquisition Corporation Warrant,$2.23,-0.13,-5.508%,0.00,United States,2020,37946,Finance,Business Services
DCRC,Decarbonization Plus Acquisition Corporation III Class A Common Stock,$10.45,-1.64,-13.565%,462412500.00,United States,2021,7225690,Finance,Business Services
DCRCU,Decarbonization Plus Acquisition Corporation III Unit,$11.15,-2.3202,-17.225%,0.00,United States,2021,693541,,
DCRCW,Decarbonization Plus Acquisition Corporation III Warrant,$2.60,-1.05,-28.767%,0.00,United States,2021,1535866,Finance,Business Services
DCRN,Decarbonization Plus Acquisition Corporation II Class A Common stock,$9.87,0.02,0.203%,496584375.00,United States,2021,233715,,
DCRNU,Decarbonization Plus Acquisition Corporation II Unit,$10.30,-0.03,-0.29%,0.00,United States,2021,105288,,
DCRNW,Decarbonization Plus Acquisition Corporation II Warrant,$1.315,-0.085,-6.071%,0.00,United States,2021,372980,Finance,Business Services
DCT,Duck Creek Technologies Inc. Common Stock,$39.40,-1.26,-3.099%,5184604315.00,United States,2020,895491,Technology,Retail: Computer Software & Peripheral Equipment
DCTH,Delcath Systems Inc. Common Stock,$11.285,-0.345,-2.966%,73041011.00,United States,,23725,Health Care,Medical Specialities
DDMX,DD3 Acquisition Corp. II Class A Common Stock,$9.98,0.06,0.605%,72087536.00,Mexico,2021,5890,,
DDMXU,DD3 Acquisition Corp. II Unit,$10.50,-0.06,-0.568%,0.00,Mexico,2020,2151,,
DDMXW,DD3 Acquisition Corp. II Warrant,$1.34,0.00,0.00%,0.00,Mexico,2021,995,,
DDOG,Datadog Inc. Class A Common Stock,$96.59,-0.66,-0.679%,29786757339.00,United States,2019,1887877,Technology,EDP Services
DENN,Denny's Corporation Common Stock,$17.18,-0.15,-0.866%,1102008437.00,United States,,303244,Consumer Services,Restaurants
DFFN,Diffusion Pharmaceuticals Inc. Common Stock,$0.7422,-0.0295,-3.823%,75633133.00,United States,,911411,Health Care,Major Pharmaceuticals
DFH,Dream Finders Homes Inc. Class A Common Stock,$22.79,-0.75,-3.186%,2108564575.00,United States,2021,280143,,
DFPH,DFP Healthcare Acquisitions Corp. Class A Common Stock,$10.10,0.00,0.00%,290375000.00,United States,2020,25529,Finance,Major Banks
DFPHU,DFP Healthcare Acquisitions Corp. Unit,$10.12,0.00,0.00%,0.00,United States,2020,36,Finance,Major Banks
DFPHW,DFP Healthcare Acquisitions Corp. Warrant,$1.35,0.00,0.00%,0.00,United States,2020,509,Finance,Major Banks
DGICA,Donegal Group Inc. Class A Common Stock,$15.44,0.20,1.312%,476538462.00,United States,,48147,Finance,Property-Casualty Insurers
DGICB,Donegal Group Inc. Class B Common Stock,$14.10,-0.50,-3.425%,435180849.00,United States,1986,679,Finance,Property-Casualty Insurers
DGII,Digi International Inc. Common Stock,$19.91,0.05,0.252%,677527664.00,United States,1989,129292,Technology,Computer peripheral equipment
DGLY,Digital Ally Inc. Common Stock,$1.78,-0.16,-8.247%,91694370.00,United States,,3035196,Technology,Radio And Television Broadcasting And Communications Equipment
DGNS,Dragoneer Growth Opportunities Corp. II Class A Ordinary Shares,$10.25,0.00,0.00%,361333000.00,United States,2020,97274,Finance,Business Services
DGNU,Dragoneer Growth Opportunities Corp. III Class A Ordinary Shares,$10.10,0.08,0.798%,505000000.00,United States,2021,440516,Finance,Business Services
DHBC,DHB Capital Corp. Class A common stock,$9.71,0.00,0.00%,348953125.00,United States,2021,342,,
DHBCU,DHB Capital Corp. Unit,$10.00,0.00,0.00%,359375000.00,United States,2021,93402,,
DHBCW,DHB Capital Corp. Warrant,$0.7375,-0.0276,-3.607%,0.00,United States,2021,54279,,
DHC,Diversified Healthcare Trust Common Shares of Beneficial Interest,$4.14,0.01,0.242%,986431499.00,United States,,2242582,Consumer Services,Real Estate Investment Trusts
DHCA,DHC Acquisition Corp. Class A ordinary share,$9.73,0.08,0.829%,375821250.00,United States,2021,233,Finance,Business Services
DHCAU,DHC Acquisition Corp. Unit,$10.01,0.00,0.00%,0.00,United States,2021,25903,Finance,Business Services
DHCAW,DHC Acquisition Corp. Warrant,$0.9202,0.00,0.00%,0.00,United States,2021,24,Finance,Business Services
DHCNI,Diversified Healthcare Trust 5.625% Senior Notes due 2042,$23.33,0.03,0.129%,0.00,United States,,13247,Consumer Services,Real Estate Investment Trusts
DHCNL,Diversified Healthcare Trust 6.25% Senior Notes Due 2046,$24.95,-0.03,-0.12%,0.00,United States,,8148,Consumer Services,Real Estate Investment Trusts
DHHC,DiamondHead Holdings Corp. Class A Common Stock,$9.72,0.00,0.00%,419175000.00,United States,2021,10,,
DHHCU,DiamondHead Holdings Corp. Unit,$10.00,0.00,0.00%,0.00,United States,2021,1133,,
DHHCW,DiamondHead Holdings Corp. Warrant,$1.06,0.00,0.00%,0.00,United States,2021,10378,Finance,Business Services
DHIL,Diamond Hill Investment Group Inc. Class A Common Stock,$177.99,1.36,0.77%,568487601.00,United States,,6928,Finance,Investment Managers
DIBS,1stdibs.com Inc. Common Stock,$23.05,-0.90,-3.758%,843538376.00,United States,2021,195053,,
DILAU,DILA Capital Acquisition Corp. Unit,$9.99,-0.01,-0.10%,0.00,Mexico,,1463553,,
DIOD,Diodes Incorporated Common Stock,$77.11,-0.50,-0.644%,3440394894.00,United States,,132825,Technology,Semiconductors
DISA,Disruptive Acquisition Corporation I Class A Ordinary Shares,$9.66,0.00,0.00%,332062500.00,United States,2021,64,Finance,Business Services
DISAU,Disruptive Acquisition Corporation I Unit,$9.94,0.00,0.00%,0.00,United States,2021,5655,Finance,Business Services
DISAW,Disruptive Acquisition Corporation I Warrant,$0.83,0.00,0.00%,0.00,United States,2021,217288,Finance,Business Services
DISCA,Discovery Inc. Series A Common Stock,$30.07,-0.75,-2.433%,15197600728.00,United States,,6906535,Consumer Services,Television Services
DISCB,Discovery Inc. Series B Common Stock,$68.61,0.00,0.00%,34676002194.00,United States,,737,Consumer Services,Television Services
DISCK,Discovery Inc. Series C Common Stock,$28.31,-0.53,-1.838%,14308083692.00,United States,,2937965,Consumer Services,Television Services
DISH,DISH Network Corporation Class A Common Stock,$40.16,0.13,0.325%,21192615009.00,United States,1995,2100326,Consumer Services,Television Services
DJCO,Daily Journal Corp. (S.C.) Common Stock,$344.40,-0.01,-0.003%,475528922.00,United States,,2187,Consumer Services,Newspapers/Magazines
DKDCU,Data Knights Acquisition Corp. Unit,$10.18,0.00,0.00%,0.00,United Kingdom,2021,13172,,
DKNG,DraftKings Inc. Class A Common Stock,$48.51,-2.11,-4.168%,19483746850.00,United States,2019,87973785,Consumer Services,Services-Misc. Amusement & Recreation
DLCA,Deep Lake Capital Acquisition Corp. Class A Ordinary Shares,$9.69,-0.01,-0.103%,250728750.00,United States,2021,9438,Finance,Business Services
DLCAU,Deep Lake Capital Acquisition Corp. Unit,$10.04,0.005,0.05%,0.00,United States,2021,201752,Finance,Business Services
DLCAW,Deep Lake Capital Acquisition Corp. Warrant,$0.74,0.02,2.778%,0.00,United States,2021,5195,Finance,Business Services
DLHC,DLH Holdings Corp.,$12.585,0.095,0.761%,157877642.00,United States,,4296,Technology,Professional Services
DLO,DLocal Limited Class A Common Shares,$31.15,-0.15,-0.479%,9124326080.00,Uruguay,2021,178809,,
DLPN,Dolphin Entertainment Inc. Common Stock,$8.64,-0.69,-7.395%,65666644.00,United States,,607380,,
DLTH,Duluth Holdings Inc. Class B Common Stock,$17.54,-0.33,-1.847%,579221982.00,United States,2015,126394,Consumer Services,Department/Specialty Retail Stores
DLTR,Dollar Tree Inc. Common Stock,$100.68,0.48,0.479%,23353115833.00,United States,1995,3260537,Consumer Services,Department/Specialty Retail Stores
DMAC,DiaMedica Therapeutics Inc. Common Stock,$8.63,-0.54,-5.889%,161718209.00,United States,2018,122541,,
DMLP,Dorchester Minerals L.P. Common Units Representing Limited Partnership Interests,$17.72,0.96,5.728%,614525595.00,United States,,91556,Energy,Oil & Gas Production
DMRC,Digimarc Corporation Common Stock,$31.62,-1.22,-3.715%,534846956.00,United States,,104776,Technology,EDP Services
DMTK,DermTech Inc. Common Stock,$41.22,-1.75,-4.073%,1192852719.00,United States,2017,503513,Health Care,Managed Health Care
DNLI,Denali Therapeutics Inc. Common Stock,$73.58,-1.48,-1.972%,8917322812.00,United States,2017,385260,Health Care,Biotechnology: Biological Products (No Diagnostic Substances)
DOCU,DocuSign Inc. Common Stock,$250.48,-6.78,-2.635%,48802302110.00,United States,2018,2869533,Technology,EDP Services
DOGZ,Dogness (International) Corporation Class A Common Stock,$1.94,0.00,0.00%,56987139.00,China,2017,5072282,Consumer Durables,Miscellaneous manufacturing industries
DOMO,Domo Inc. Class B Common Stock,$73.11,0.34,0.467%,2316168227.00,United States,2018,192910,Technology,Computer Software: Prepackaged Software
DOOO,BRP Inc. (Recreational Products) Common Subordinate Voting Shares,$79.95,2.68,3.468%,6715015371.00,Canada,,189875,,
DORM,Dorman Products Inc. Common Stock,$103.01,1.46,1.438%,3304826463.00,United States,,66087,Capital Goods,Auto Parts:O.E.M.
DOX,Amdocs Limited Ordinary Shares,$80.65,-0.01,-0.012%,10295295100.00,Guernsey,,502853,Technology,EDP Services
DOYU,DouYu International Holdings Limited ADS,$7.82,-0.41,-4.982%,2536884558.00,China,2019,1509343,Technology,Computer Software: Programming Data Processing
DRIO,DarioHealth Corp. Common Stock,$21.15,0.56,2.72%,347742293.00,Israel,,446765,Health Care,Medical/Dental Instruments
DRNA,Dicerna Pharmaceuticals Inc. Common Stock,$35.74,-2.30,-6.046%,2748409860.00,United States,2014,716463,Health Care,Biotechnology: Commercial Physical & Biological Resarch
DRRX,DURECT Corporation Common Stock,$1.66,-0.05,-2.924%,377494262.00,United States,2000,392119,Health Care,Major Pharmaceuticals
DRTT,DIRTT Environmental Solutions Ltd. Common Shares,$3.55,0.00,0.00%,300666941.00,Canada,,34213,,
DRVN,Driven Brands Holdings Inc. Common Stock,$29.66,-0.47,-1.56%,4965435174.00,United States,2021,149334,,
DSAC,Duddell Street Acquisition Corp. Class A Ordinary Shares,$9.72,0.02,0.206%,212625000.00,Hong Kong,2020,3397,Finance,Business Services
DSACU,Duddell Street Acquisition Corp. Unit,$10.23,0.00,0.00%,0.00,Hong Kong,2020,12,Finance,Business Services
DSACW,Duddell Street Acquisition Corp. Warrant,$0.97,-0.02,-2.02%,0.00,Hong Kong,2020,9100,Finance,Business Services
DSEY,Diversey Holdings Ltd. Ordinary Shares,$17.96,-0.11,-0.609%,5410362463.00,United States,2021,466255,Consumer Durables,Specialty Chemicals
DSGN,Design Therapeutics Inc. Common Stock,$27.04,-0.53,-1.922%,1503892387.00,United States,2021,301888,Health Care,Major Pharmaceuticals
DSGX,Descartes Systems Group Inc. (The) Common Stock,$67.21,-0.37,-0.547%,5680216521.00,Canada,,56181,,
DSKE,Daseke Inc. Common Stock,$7.38,-0.08,-1.072%,481129277.00,United States,2015,285129,,
DSKEW,Daseke Inc. Warrant,$0.137,0.007,5.385%,0.00,United States,2015,7780,,
DSP,Viant Technology Inc. Class A Common Stock,$28.69,-2.16,-7.002%,1690861188.00,United States,2021,247814,Technology,EDP Services
DSPG,DSP Group Inc. Common Stock,$16.19,-0.03,-0.185%,392231601.00,United States,1994,65145,Technology,Semiconductors
DSWL,Deswell Industries Inc. Common Shares,$4.66,-0.09,-1.895%,74165014.00,Macau,1995,26755,Consumer Non-Durables,Plastic Products
DTEA,DAVIDsTEA Inc. Common Stock,$5.31,-0.12,-2.21%,139418133.00,Canada,2015,624463,Consumer Services,Restaurants
DTIL,Precision BioSciences Inc. Common Stock,$10.98,-0.63,-5.426%,631133979.00,United States,2019,467928,Health Care,Major Pharmaceuticals
DTOC,Digital Transformation Opportunities Corp. Class A Common Stock,$9.78,0.00,0.00%,407703750.00,United States,2021,759,,
DTOCU,Digital Transformation Opportunities Corp. Units,$9.926,0.016,0.161%,0.00,United States,2021,800,,
DTOCW,Digital Transformation Opportunities Corp. Warrant,$0.9001,0.1046,13.149%,0.00,United States,2021,273804,Finance,Business Services
DTSS,Datasea Inc. Common Stock,$2.55,-0.19,-6.934%,54759052.00,China,,50086,Technology,Retail: Computer Software & Peripheral Equipment
DTST,Data Storage Corporation Common Stock,$5.55,-0.39,-6.566%,26966723.00,United States,,193924,Technology,EDP Services
DTSTW,Data Storage Corporation Warrant,$1.00,-0.1262,-11.206%,0.00,United States,,7001,,
DUNE,Dune Acquisition Corporation Class A Common Stock,$9.80,0.01,0.102%,,United States,2021,22508,,
DUNEU,Dune Acquisition Corporation Unit,$10.12,0.03,0.297%,0.00,United States,2020,2603,,
DUNEW,Dune Acquisition Corporation Warrant,$0.72,0.0199,2.842%,0.00,United States,2021,3041,Finance,Business Services
DUO,Fangdd Network Group Ltd. American Depositary Shares,$3.09,-0.19,-5.793%,246726498.00,China,2019,277700,Technology,Computer Software: Programming Data Processing
DUOT,Duos Technologies Group Inc. Common Stock,$10.70,0.09,0.848%,38212846.00,United States,,23601,Technology,Computer Software: Prepackaged Software
DVAX,Dynavax Technologies Corporation Common Stock,$8.89,-0.13,-1.441%,1018689205.00,United States,2004,2637141,Health Care,Major Pharmaceuticals
DWSN,Dawson Geophysical Company Common Stock,$2.73,-0.02,-0.727%,64095137.00,United States,,16613,Energy,Oil & Gas Production
DXCM,DexCom Inc. Common Stock,$405.10,-3.99,-0.975%,39175549152.00,United States,2005,620923,Health Care,Medical/Dental Instruments
DXPE,DXP Enterprises Inc. Common Stock,$32.49,0.24,0.744%,624032928.00,United States,,87947,Capital Goods,Industrial Machinery/Components
DXYN,Dixie Group Inc. (The) Common Stock,$2.51,-0.09,-3.462%,39559086.00,United States,,60567,Consumer Durables,Home Furnishings
DYAI,Dyadic International Inc. Common Stock,$3.53,-0.06,-1.671%,97266174.00,United States,,151514,Health Care,Biotechnology: Biological Products (No Diagnostic Substances)
DYN,Dyne Therapeutics Inc. Common Stock,$20.46,-0.48,-2.292%,1052603635.00,United States,2020,241836,Consumer Durables,Specialty Chemicals
DYNS,Dynamics Special Purpose Corp. Class A Common Stock,$9.97,-0.07,-0.697%,293771035.00,United States,2021,35827,Technology,Computer Manufacturing
DYNT,Dynatronics Corporation Common Stock,$1.24,-0.01,-0.80%,21532171.00,United States,,84077,Health Care,Medical/Dental Instruments
DZSI,DZS Inc. Common Stock,$22.21,0.40,1.834%,597841806.00,United States,,279730,Public Utilities,Telecommunications Equipment
EA,Electronic Arts Inc. Common Stock,$144.80,-3.75,-2.524%,41440482285.00,United States,,1795227,Technology,Computer Software: Prepackaged Software
EAC,Edify Acquisition Corp. Class A Common Stock,$9.71,0.035,0.362%,334995000.00,United States,2021,5487,,
EACPU,Edify Acquisition Corp. Units,$9.97,0.02,0.201%,0.00,United States,2021,452,,
EACPW,Edify Acquisition Corp. Warrant,$0.61,0.00,0.00%,0.00,United States,2021,175002,Finance,Business Services
EAR,Eargo Inc. Common Stock,$37.01,-1.48,-3.845%,1433454221.00,United States,2020,505350,Health Care,Medical Specialities
